{
  "aggregate_cases": [
    {
      "expected": {
        "groups": [],
        "metrics": {
          "all": {
            "bytes": 0,
            "files": 0
          },
          "unignored": {
            "bytes": 0,
            "files": 0
          }
        },
        "no_extension": {
          "filenames": [],
          "metrics": {
            "all": {
              "bytes": 0,
              "files": 0
            },
            "unignored": {
              "bytes": 0,
              "files": 0
            }
          },
          "others": null
        },
        "registry": {
          "fingerprint": "08c341b55028cd9b379decedff9429c5809b878ee25b11018d4f6dfae069b2c2",
          "revision": 1,
          "schema_version": 1
        },
        "remaining_types": {
          "extensions": [],
          "metrics": {
            "all": {
              "bytes": 0,
              "files": 0
            },
            "unignored": {
              "bytes": 0,
              "files": 0
            }
          },
          "others": null
        },
        "schema": "file-type-breakdown-v1"
      },
      "facts": [],
      "id": "empty-directory"
    },
    {
      "expected": {
        "groups": [
          {
            "families": [
              {
                "extensions": [
                  {
                    "extension": ".log",
                    "metrics": {
                      "all": {
                        "bytes": 80,
                        "files": 1
                      },
                      "unignored": {
                        "bytes": 0,
                        "files": 0
                      }
                    }
                  },
                  {
                    "extension": ".jsonl",
                    "metrics": {
                      "all": {
                        "bytes": 100,
                        "files": 1
                      },
                      "unignored": {
                        "bytes": 100,
                        "files": 1
                      }
                    }
                  }
                ],
                "id": "log-files",
                "metrics": {
                  "all": {
                    "bytes": 180,
                    "files": 2
                  },
                  "unignored": {
                    "bytes": 100,
                    "files": 1
                  }
                }
              }
            ],
            "id": "logs"
          },
          {
            "families": [
              {
                "extensions": [
                  {
                    "extension": ".tar.gz",
                    "metrics": {
                      "all": {
                        "bytes": 200,
                        "files": 1
                      },
                      "unignored": {
                        "bytes": 200,
                        "files": 1
                      }
                    }
                  }
                ],
                "id": "archives",
                "metrics": {
                  "all": {
                    "bytes": 200,
                    "files": 1
                  },
                  "unignored": {
                    "bytes": 200,
                    "files": 1
                  }
                }
              }
            ],
            "id": "archives"
          },
          {
            "families": [
              {
                "extensions": [
                  {
                    "extension": ".svg",
                    "metrics": {
                      "all": {
                        "bytes": 60,
                        "files": 1
                      },
                      "unignored": {
                        "bytes": 60,
                        "files": 1
                      }
                    }
                  }
                ],
                "id": "images",
                "metrics": {
                  "all": {
                    "bytes": 60,
                    "files": 1
                  },
                  "unignored": {
                    "bytes": 60,
                    "files": 1
                  }
                }
              }
            ],
            "id": "media"
          }
        ],
        "metrics": {
          "all": {
            "bytes": 1590,
            "files": 50
          },
          "unignored": {
            "bytes": 1268,
            "files": 40
          }
        },
        "no_extension": {
          "filenames": [
            {
              "basename": "bare-22",
              "metrics": {
                "all": {
                  "bytes": 22,
                  "files": 1
                },
                "unignored": {
                  "bytes": 22,
                  "files": 1
                }
              }
            },
            {
              "basename": "bare-20",
              "metrics": {
                "all": {
                  "bytes": 20,
                  "files": 1
                },
                "unignored": {
                  "bytes": 20,
                  "files": 1
                }
              }
            },
            {
              "basename": "bare-19",
              "metrics": {
                "all": {
                  "bytes": 19,
                  "files": 1
                },
                "unignored": {
                  "bytes": 19,
                  "files": 1
                }
              }
            },
            {
              "basename": "bare-18",
              "metrics": {
                "all": {
                  "bytes": 18,
                  "files": 1
                },
                "unignored": {
                  "bytes": 18,
                  "files": 1
                }
              }
            },
            {
              "basename": "bare-17",
              "metrics": {
                "all": {
                  "bytes": 17,
                  "files": 1
                },
                "unignored": {
                  "bytes": 17,
                  "files": 1
                }
              }
            },
            {
              "basename": "bare-16",
              "metrics": {
                "all": {
                  "bytes": 16,
                  "files": 1
                },
                "unignored": {
                  "bytes": 16,
                  "files": 1
                }
              }
            },
            {
              "basename": "bare-15",
              "metrics": {
                "all": {
                  "bytes": 15,
                  "files": 1
                },
                "unignored": {
                  "bytes": 15,
                  "files": 1
                }
              }
            },
            {
              "basename": "bare-13",
              "metrics": {
                "all": {
                  "bytes": 13,
                  "files": 1
                },
                "unignored": {
                  "bytes": 13,
                  "files": 1
                }
              }
            },
            {
              "basename": "bare-12",
              "metrics": {
                "all": {
                  "bytes": 12,
                  "files": 1
                },
                "unignored": {
                  "bytes": 12,
                  "files": 1
                }
              }
            },
            {
              "basename": "bare-11",
              "metrics": {
                "all": {
                  "bytes": 11,
                  "files": 1
                },
                "unignored": {
                  "bytes": 11,
                  "files": 1
                }
              }
            },
            {
              "basename": "bare-10",
              "metrics": {
                "all": {
                  "bytes": 10,
                  "files": 1
                },
                "unignored": {
                  "bytes": 10,
                  "files": 1
                }
              }
            },
            {
              "basename": "bare-9",
              "metrics": {
                "all": {
                  "bytes": 9,
                  "files": 1
                },
                "unignored": {
                  "bytes": 9,
                  "files": 1
                }
              }
            },
            {
              "basename": "bare-8",
              "metrics": {
                "all": {
                  "bytes": 8,
                  "files": 1
                },
                "unignored": {
                  "bytes": 8,
                  "files": 1
                }
              }
            },
            {
              "basename": "bare-6",
              "metrics": {
                "all": {
                  "bytes": 6,
                  "files": 1
                },
                "unignored": {
                  "bytes": 6,
                  "files": 1
                }
              }
            },
            {
              "basename": "bare-5",
              "metrics": {
                "all": {
                  "bytes": 5,
                  "files": 1
                },
                "unignored": {
                  "bytes": 5,
                  "files": 1
                }
              }
            },
            {
              "basename": "bare-4",
              "metrics": {
                "all": {
                  "bytes": 4,
                  "files": 1
                },
                "unignored": {
                  "bytes": 4,
                  "files": 1
                }
              }
            },
            {
              "basename": "bare-3",
              "metrics": {
                "all": {
                  "bytes": 3,
                  "files": 1
                },
                "unignored": {
                  "bytes": 3,
                  "files": 1
                }
              }
            },